scientificName,stateProvince,municipality,verbatimLocality,verbatimCoordinates,verbatimElevation,eventDate,habitat,observaciones,Abundancia,recordedBy,occurrenceID,basisOfRecord
Dryopteris filix-mas (L.) Schott,Lu,Folgoso do Courel,"Romeor, subida al túnel da Louseira",29TPH5622,957,KAROL-26708,"En taludes húmedos, sombríos y con abundante vegetación",,,Carolus,LOU 26708,PreservedSpecimen
Dryopteris filix-mas (L.) Schott,Lu,Folgoso do Courel,"Romeor, subida al túnel da Louseira",29TPH5622,957,KAROL-26709,"En taludes húmedos, sombríos y con abundante vegetación",,,Carolus,LOU 26709,PreservedSpecimen
Asplenium onopteris L.,Lu,Folgoso do Courel,"Romeor, subida al túnel da Louseira",29TPH5622,957,KAROL-26710,"En taludes húmedos, sombríos y con abundante vegetación",,,Mariano,LOU 26710,PreservedSpecimen
Crocus serotinus Salisb.,Lu,Folgoso do Courel,Alto do Couto,29TPH5620,1250,KAROL-26711,Sobre prados ralos muy expuestos,,,Mariano,LOU 26711,PreservedSpecimen
Cystopteris fragilis (L.) Bernh.,Lu,Folgoso do Courel,"Romeor, subida al túnel da Louseira",29TPH5622,957,KAROL-26712,"En taludes húmedos, sombríos y con abundante vegetación",,,Mariano,LOU 26712,PreservedSpecimen
Satureja nepeta (L.) Scheele,Lu,Folgoso do Courel,Prope Folgoso,29TPH4818,610,KAROL-26713,En talud de tierra desnudo,,,Mariano,LOU 26713,PreservedSpecimen
Malva moschata L.,Lu,Folgoso do Courel,"Romeor, subida al túnel da Louseira",29TPH5622,957,KAROL-26714,En el margen de la carretera,,,Carolus,LOU 26714,PreservedSpecimen
Echium plantagineum L.,Lu,Folgoso do Courel,"Romeor, subida al túnel da Louseira",29TPH5622,957,KAROL-26715,En prados de siega,,,Mariano,LOU 26715,PreservedSpecimen
Polypodium cambricum L.,Po,Pontevedra,Prope Pontevedra,29TNG2997,20,KAROL-26716,En muros de las calles de Pontevedra,,,Mariano,LOU 26716,PreservedSpecimen
Erigeron karvinskianus DC.,Po,Pontevedra,Prope Pontevedra,29TNG2897,8,KAROL-26717,En muros de las calles de Pontevedra,,,Bonny & Clyde,LOU 26717,PreservedSpecimen
"Cymbalaria muralis P. Gaertn., B. Mey. & Scherb.",Po,Pontevedra,Prope Pontevedra,29TNG2897,8,KAROL-26718,En muros de las calles de Pontevedra,,,Mariano,LOU 26718,PreservedSpecimen
Bidens aurea (Aiton) Sherff,Po,Bueu,"Cela, playa de Lapamán",29TNG2087,30,KAROL-26719/1,"En cunetas y márgenes de caminos, tanto de zonas secas como húmedas",,,Mariano,LOU 26719/1,PreservedSpecimen
Bidens aurea (Aiton) Sherff,Po,Bueu,"Cela, playa de Lapamán",29TNG2087,30,KAROL-26719/2,"En cunetas y márgenes de caminos, tanto de zonas secas como húmedas",,,Mariano,LOU 26719/2,PreservedSpecimen
Bidens aurea (Aiton) Sherff,Po,Bueu,"Cela, playa de Lapamán",29TNG2087,30,KAROL-26719/3,"En cunetas y márgenes de caminos, tanto de zonas secas como húmedas",,,Mariano,LOU 26719/3,PreservedSpecimen
Crocus serotinus Salisb.,Po,Cangas,"Playa de Melide, Donón, Cabo Home",29TNG1177,20,KAROL-26720,"En suelo arenoso, bajo bosque de pinos",,,Bonny & Clyde,LOU 26720,PreservedSpecimen
Satureja nepeta (L.) Scheele,Po,Cangas,"Playa de Melide, Donón, Cabo Home",29TNG1177,21,KAROL-26721,"En suelo arenoso, bajo bosque de pinos",,,Bonny & Clyde,LOU 26721,PreservedSpecimen
Arisarum vulgare Targ.-Tozz.,Po,Cangas,"Playa de Melide, Donón, Cabo Home",29TNG1177,22,KAROL-26722,"En suelo arenoso, bajo bosque de pinos",,,Mariano,LOU 26722,PreservedSpecimen
Delphinium halteratum Sm.,Or,Riós,Pousada,29TPG4646,710,KAROL-26723,"talud, bajo Cytisus en pista forestal",,,Bonny & Clyde,LOU 26723,PreservedSpecimen
Lathyrus latifolius L.,Or,Riós,Pousada,29TPG4546,710,KAROL-26724,"talud, bajo Cytisus en pista forestal",,,Carolus,LOU 26724,PreservedSpecimen
Lactuca viminea (L.) J. Presl & C. Presl,Or,Riós,Rubiós,29TPG4146,670,KAROL-26725,cuneta de carretera,,,Bonny & Clyde,LOU 26725,PreservedSpecimen
Chondrilla juncea L.,Or,Riós,Rubiós,29TPG4146,670,KAROL-26726,cuneta de carretera,,,Bonny & Clyde,LOU 26726,PreservedSpecimen
Cyperus longus L.,Or,Riós,Rubiós,29TPG4146,670,KAROL-26727,"prado húmedo, cerca de arroyo",,,Mariano,LOU 26727,PreservedSpecimen
Polygala vulgaris L.,Or,Riós,Rubiós,29TPG4146,670,KAROL-26728,prado cerca de arroyo,,,Mariano,LOU 26728,PreservedSpecimen
Mentha suaveolens Ehrh.,Or,Riós,Rubiós,29TPG4146,670,KAROL-26729,"prado húmedo, cerca de arroyo",,,Mariano,LOU 26729,PreservedSpecimen
Thymus pulegioides L.,Or,Riós,Rubiós,29TPG4146,670,KAROL-26730,"prado húmedo, cerca de arroyo",,,Carolus,LOU 26730,PreservedSpecimen
Wahlenbergia hederacea (L.) Rchb.,Or,Riós,Rubiós,29TPG4146,670,KAROL-26731,"prado húmedo, cerca de arroyo",,,Carolus,LOU 26731,PreservedSpecimen
Hieracium pilosella L.,Or,Riós,Rubiós,29TPG4146,670,KAROL-26732,"prado húmedo, cerca de arroyo",,,Mariano,LOU 26732,PreservedSpecimen
Carum verticillatum (L.) W.D.J. Koch,Or,Riós,Rubiós,29TPG4146,670,KAROL-26733,"prado húmedo, cerca de arroyo",,,Bonny & Clyde,LOU 26733,PreservedSpecimen
Solanum dulcamara L.,Or,Riós,Rubiós,29TPG4146,670,KAROL-26734,"prado húmedo, cerca de arroyo",,,Bonny & Clyde,LOU 26734,PreservedSpecimen
Scutellaria minor Huds.,Or,Riós,Rubiós,29TPG4146,670,KAROL-26735,"prado húmedo, cerca de arroyo",,,Carolus,LOU 26735,PreservedSpecimen
Filipendula ulmaria (L.) Maxim.,Or,Riós,Rubiós,29TPG4146,670,KAROL-26737,"prado húmedo, cerca de arroyo",,,Mariano,LOU 26737,PreservedSpecimen
Alnus glutinosa (L.) Gaertn.,Or,Riós,Rubiós,29TPG4146,670,KAROL-26738,bosque de ribera,,,Mariano,LOU 26738,PreservedSpecimen
Calluna vulgaris (L.) Hull,Or,Riós,Rubiós,29TPG4146,670,KAROL-26739,orla de bosque,,,Carolus,LOU 26739,PreservedSpecimen
Humulus lupulus L.,Mi,,Valença do Minho,29TNG3355,,KAROL-26740,"bosque de ribera, junto a un campo de maíz",,,Bonny & Clyde,LOU 26740,PreservedSpecimen
Xanthium strumarium subsp. italicum (Moretti) D. Löve,Mi,,Valença do Minho,29TNG3355,,KAROL-26741,"bosque de ribera, junto a un campo de maíz",,,Mariano,LOU 26741,PreservedSpecimen
Crocus serotinus Salisb.,Lu,Abadín,"O Xistral, A Laxe, a orillas del río Eume",29TPJ1610,790,KAROL-26742,Monte bajo,,,Mariano,LOU 26742,PreservedSpecimen
Senecio nemorensis L.,Lu,Abadín,"O Xistral, A Laxe, a orillas del río Eume",29TPJ1609,770,KAROL-26743,A orillas del río Eume,,,Bonny & Clyde,LOU 26743,PreservedSpecimen
Anagallis tenella (L.) L.,Lu,Abadín,"O Xistral, A Laxe, a orillas del río Eume",29TPJ1509,700,KAROL-26744,A orillas del río Eume,,,Mariano,LOU 26744,PreservedSpecimen
Hypericum elodes L.,Lu,Abadín,"O Xistral, A Laxe, a orillas del río Eume",29TPJ1509,700,KAROL-26745,A orillas del río Eume,,,Mariano,LOU 26745,PreservedSpecimen
Scabiosa columbaria L.,Lu,Abadín,"O Xistral, A Laxe, a orillas del río Eume",29TPJ1509,700,KAROL-26746,A orillas del río Eume,,,Mariano,LOU 26746,PreservedSpecimen
Erica arborea L.,Lu,Abadín,"O Xistral, A Laxe, a orillas del río Eume",29TPJ1610,790,KAROL-26747,Población aislada en ladera sobre el río,,,Bonny & Clyde,LOU 26747,PreservedSpecimen
Erica mackaiana Bab.,Lu,Abadín,"O Xistral, A Laxe, a orillas del río Eume",29TPJ1610,770,KAROL-26748,Turbera,,,Carolus,LOU 26748,PreservedSpecimen
Daboecia cantabrica (Huds.) K. Koch,Lu,Abadín,"O Xistral, A Laxe, a orillas del río Eume",29TPJ1610,770,KAROL-26749,Turbera,,,Carolus,LOU 26749,PreservedSpecimen
Verbascum virgatum Stokes,Po,Vigo,Sárdoma,29TNG2374,,KAROL-26750,ambiente ruderalizado,,,Bonny & Clyde,LOU 26750,PreservedSpecimen
Tamarix gallica L.,C,Cedeira,Praia de Vilarrube,29TNJ7432,20,KAROL-26751,,,,Carolus,LOU 26751,PreservedSpecimen
Pulicaria dysenterica (L.) Bernh.,C,Valdoviño,Playa de Pantín,29TNJ7132,50,KAROL-26752,Ladera sobre la playa,,,Carolus,LOU 26752,PreservedSpecimen
Trifolium pratense L.,C,Valdoviño,Playa de Pantín,29TNJ7132,50,KAROL-26753,Ladera sobre la playa,,,Mariano,LOU 26753,PreservedSpecimen
Foeniculum vulgare Mill.,C,Valdoviño,Playa de Pantín,29TNJ7132,50,KAROL-26754,Ladera sobre la playa,,,Mariano,LOU 26754,PreservedSpecimen
Conyza canadensis (L.) Cronquist,C,Valdoviño,Playa de Pantín,29TNJ7132,50,KAROL-26755,Ladera sobre la playa,,,Mariano,LOU 26755,PreservedSpecimen
Eupatorium cannabinum L.,C,Valdoviño,Playa de Pantín,29TNJ7132,50,KAROL-26756,Ladera sobre la playa,,,Bonny & Clyde,LOU 26756,PreservedSpecimen
Satureja ascendens (Jord.) K. Malý,C,Valdoviño,Playa de Pantín,29TNJ7132,50,KAROL-26757,Ladera sobre la playa,,,Mariano,LOU 26757,PreservedSpecimen
Asplenium onopteris L.,C,Cedeira,Esteiro,29TNJ7432,20,KAROL-26758,Talud sobre la playa,,,Carolus,LOU 26758,PreservedSpecimen
Smilax aspera L.,C,Valdoviño,Vilarrube,29TNJ7432,50,KAROL-26759,Talud carretera bajo Laurus nobilis,,,Mariano,LOU 26759,PreservedSpecimen
Equisetum telmateia Ehrh.,C,Cedeira,Esteiro,29TNJ7532,,KAROL-26760,Acequia en carretera con agua,,,Bonny & Clyde,LOU 26760,PreservedSpecimen
Sanguisorba officinalis L.,C,Ortigueira,Seixo,29TNJ8440,340,KAROL-26761,cuneta de carretera,,,Mariano,LOU 26761,PreservedSpecimen
Athyrium filix-femina (L.) Roth,C,Cedeira,San Andrés de Teixido,29TNJ8440,,KAROL-26762,"Bosque de ribera, talud sobre la carretera",,,Carolus,LOU 26762,PreservedSpecimen
Molinia caerulea (L.) Moench,C,Cedeira,San Andrés de Teixido,29TNJ8440,,KAROL-26763,"Bosque de ribera, talud sobre la carretera",,,Carolus,LOU 26763,PreservedSpecimen
Potentilla montana Brot.,C,Cedeira,San Andrés de Teixido,29TNJ8440,,KAROL-26764,Taludes sobre la carretera bajo Corylus avellana,,,Mariano,LOU 26764,PreservedSpecimen
Erica mackaiana Bab.,C,Cedeira,San Andrés de Teixido,29TNJ8440,,KAROL-26765,"Bosque de ribera, talud sobre la carretera",,,Carolus,LOU 26765,PreservedSpecimen
Woodwardia radicans (L.) Sm.,C,Ortigueira,Seixo,29TNJ8440,340,KAROL-26766,ladera umbrosa próxima a riachuelo,,,Carolus,LOU 26766,PreservedSpecimen
Erica vagans L.,C,Cedeira,San Andrés de Teixido,29TNJ8240,320,KAROL-26767,En ladera sobre el mar con monte bajo,,,Carolus,LOU 26767,PreservedSpecimen
Lobelia urens L.,C,Cedeira,San Andrés de Teixido,29TNJ8539,260,KAROL-26768,Próximo a riachuelo,,,Mariano,LOU 26768,PreservedSpecimen
Centaurium erythraea Rafn,C,Ortigueira,Seixo,29TNJ8440,340,KAROL-26769,cuneta de carretera,,,Bonny & Clyde,LOU 26769,PreservedSpecimen
Equisetum telmateia Ehrh.,C,Ortigueira,Seixo,29TNJ8440,340,KAROL-26770,Cerca de riachuelo bajo Pinus,,,Carolus,LOU 26770,PreservedSpecimen
Eryngium duriaei Boiss.,Lu,Pedrafita do Cebreiro,Devesa de Fontefermosa,29TPH6022,,KAROL-26771,esquistos,,,Mariano,LOU 26771,PreservedSpecimen
Dryopteris affinis (Lowe) Fraser-Jenk.,Lu,Pedrafita do Cebreiro,Devesa de Fontefermosa,29TPH6022,,KAROL-26772,esquistos,,,Bonny & Clyde,LOU 26772,PreservedSpecimen
Ceterach officinarum Willd.,Lu,Pedrafita do Cebreiro,Riocereixa,29TPH52,,KAROL-26773,grietas en muro calizo,,,Carolus,LOU 26773,PreservedSpecimen
Linaria triornithophora (L.) Willd.,Lu,Pedrafita do Cebreiro,Devesa de Fontefermosa,29TPH6022,,KAROL-26774,esquistos,,,Carolus,LOU 26774,PreservedSpecimen
Oxalis corniculata L.,Po,Vilagarcía de Arousa,"Arealonga, Santa Baia",29TNH1915,10,KAROL-26775,En muros de la localidad,,,Carolus,LOU 26775,PreservedSpecimen
Arundo donax L.,Po,Vilagarcía de Arousa,"Arealonga, Santa Baia",29TNH1915,10,KAROL-26776,En las márgenes del río,,,Carolus,LOU 26776,PreservedSpecimen
Zostera marina L.,Po,O Grove,Illa de A Toxa. Ensenada del Vao,29TNH1203,0,KAROL-26777,En la costa varadas,,,Mariano,LOU 26777,PreservedSpecimen
Thymus pulegioides L.,Lu,Cervantes,Degrada,29TPH6744,1220,KAROL-26778,talud de esquistos húmedo orientado al N,,,Carolus,LOU 26778,PreservedSpecimen
Asplenium adiantum-nigrum L.,Lu,Cervantes,entre Degrada y Piornedo,29TPH4343,950,KAROL-26779,talud rocoso húmedo de esquistos,,,Bonny & Clyde,LOU 26779,PreservedSpecimen
Veronica officinalis L.,Lu,Cervantes,Degrada,29TPH6744,1220,KAROL-26780,talud de esquistos húmedo orientado al N,,,Bonny & Clyde,LOU 26780,PreservedSpecimen
Juncus effusus L.,Lu,Cervantes,Degrada,29TPH6744,1220,KAROL-26781,talud de esquistos húmedo orientado al N,,,Bonny & Clyde,LOU 26781,PreservedSpecimen
Senecio jacobaea L.,Lu,Samos,supra Teixeira,29TPH5028,1230,KAROL-26782,collado con sustrato calizo,,,Mariano,LOU 26782,PreservedSpecimen
Polystichum setiferum (Forssk.) Woyn.,Lu,Cervantes,"Mosteiro, Camping Ancares",29TPH5844,470,KAROL-26783,talud en el camping,,,Mariano,LOU 26783,PreservedSpecimen
Polypodium sp.,O,Taramundi,Veigas,29TPH5599,320,KAROL-26784,bosque de ribera,,,Carolus,LOU 26784,PreservedSpecimen
Osyris alba L.,Or,Pobra de Trives,Ponte Bibei,29TPG4788,330,KAROL-26785,Taludes rocoso sobre el río Bibei,,,Bonny & Clyde,LOU 26785,PreservedSpecimen
Asplenium onopteris L.,Or,Maceda,Subida carretera Esgos a O Rodicio,29TPG1584,810,KAROL-26786,Talud sobre granito,,,Bonny & Clyde,LOU 26786,PreservedSpecimen
Asplenium adiantum-nigrum L.,Or,Maceda,Subida carretera Esgos a O Rodicio,29TPG1584,810,KAROL-26787,Bajo Quercus robur debajo de una fuente,,,Bonny & Clyde,LOU 26787,PreservedSpecimen
Pyrus cordata Desv.,Po,Moaña,Monte Jaján,29TNG2487,,KAROL-26788,Zona húmeda próxima a riachuelo estacional,,,Bonny & Clyde,LOU 26788,PreservedSpecimen
Scabiosa columbaria L.,Lu,Samos,supra Teixeira,29TPH5028,1230,KAROL-26789,collado con sustrato calizo,,,Mariano,LOU 26789,PreservedSpecimen
Phillyrea angustifolia L.,Or,Pobra de Trives,Ponte Bibei,29TPG4788,330,KAROL-26790,Talud rocoso,,,Carolus,LOU 26790,PreservedSpecimen
Plantago media L.,Lu,Samos,supra Teixeira,29TPH5028,1230,KAROL-26791,collado con sustrato calizo,,,Bonny & Clyde,LOU 26791,PreservedSpecimen
Linaria saxatilis (L.) Chaz.,Lu,Samos,supra Teixeira,29TPH5028,1230,KAROL-26792,collado con sustrato calizo,,,Bonny & Clyde,LOU 26792,PreservedSpecimen
Centaurium erythraea Rafn,Lu,Samos,supra Teixeira,29TPH5028,1230,KAROL-26793,collado con sustrato calizo,,,Carolus,LOU 26793,PreservedSpecimen
Erica tetralix L.,Or,Pobra de Trives,Ponte Bibei,29TPG4788,330,KAROL-26794,Talud rezumante sobre el río Bibei,,,Carolus,LOU 26794,PreservedSpecimen
Asplenium trichomanes subsp. quadrivalens D.E. Mey.,Or,Pobra de Trives,Ponte Bibei,29TPG4788,330,KAROL-26795,Taludes rocoso sobre el río Bibei,,,Carolus,LOU 26795,PreservedSpecimen
Ceratocapnos claviculata (L.) Lidén,O,Taramundi,Veigas,29TPH5599,320,KAROL-26796,grietas de muros en el pueblo,,,Bonny & Clyde,LOU 26796,PreservedSpecimen
Achillea millefolium L.,Lu,Samos,supra Teixeira,29TPH5028,1230,KAROL-26797,collado con sustrato calizo,,,Bonny & Clyde,LOU 26797,PreservedSpecimen
Dianthus hyssopifolius L.,Lu,Samos,supra Teixeira,29TPH5028,1230,KAROL-26798,collado con sustrato calizo,,,Bonny & Clyde,LOU 26798,PreservedSpecimen
Tribulus terrestris L.,Po,Cangas,Praia do Medio,29TNG1777,10,KAROL-26799,terreno arenoso próximo a la playa,,escaso,Bonny & Clyde,LOU 26799,PreservedSpecimen
Hypericum undulatum Willd.,Lu,Cervantes,entre Degrada y Piornedo,29TPH4343,950,KAROL-26800,talud rocoso húmedo de esquistos,,,Mariano,LOU 26800,PreservedSpecimen
Cystopteris sp.,O,Taramundi,Veigas,29TPH5599,320,KAROL-26801,bosque de ribera,,,Carolus,LOU 26801,PreservedSpecimen
Polystichum setiferum (Forssk.) Woyn.,Lu,Samos,supra Teixeira,29TPH5028,1230,KAROL-26802,collado con sustrato calizo,,,Mariano,LOU 26802,PreservedSpecimen
Hypericum undulatum Willd.,Or,Pobra de Trives,Ponte Bibei,29TPG4788,330,KAROL-26803,Talud rezumante sobre el río Bibei,,,Bonny & Clyde,LOU 26803,PreservedSpecimen
Pistacia terebinthus L.,Or,Pobra de Trives,Ponte Bibei,29TPG4788,330,KAROL-26804,Taludes rocoso sobre el río Bibei,,,Carolus,LOU 26804,PreservedSpecimen
Adiantum capillus-veneris L.,Or,Pobra de Trives,Ponte Bibei,29TPG4788,330,KAROL-26805,Talud rezumante sobre el río Bibei,,,Mariano,LOU 26805,PreservedSpecimen
Lathyrus latifolius L.,Or,Pobra de Trives,Ponte Bibei,29TPG4787,350,KAROL-26806,Cuneta carretera,,,Bonny & Clyde,LOU 26806,PreservedSpecimen
Centaurea paniculata L.,Or,Pobra de Trives,Ponte Bibei,29TPG4787,350,KAROL-26807,Cuneta carretera,,,Bonny & Clyde,LOU 26807,PreservedSpecimen
Daphne gnidium L.,Or,Pobra de Trives,Ponte Bibei,29TPG4788,330,KAROL-26808,Talud rocoso,,,Mariano,LOU 26808,PreservedSpecimen
Ceterach officinarum Willd.,Or,Pobra de Trives,Ponte Bibei,29TPG4788,330,KAROL-26809,Taludes rocoso sobre el río Bibei,,,Bonny & Clyde,LOU 26809,PreservedSpecimen
Malcolmia littorea (L.) R. Br.,Po,Cangas,Playa de Areabrava,29TNG1382,8,KAROL-26810,Dunas secundarias,,,Bonny & Clyde,LOU 26810,PreservedSpecimen
Erodium cicutarium subsp. bipinnatum Tourlet,Po,Cangas,Playa de Areabrava,29TNG1382,8,KAROL-26811,Dunas secundarias,,,Mariano,LOU 26811,PreservedSpecimen
Suaeda vera J.F. Gmel.,Po,O Grove,Illa de A Toxa,29TNH1203,1,KAROL-26812,Sobre rocas al lado del mar,,,Carolus,LOU 26812,PreservedSpecimen
Linaria polygalifolia Hoffmanns. & Link,Po,Cangas,Playa de Areabrava,29TNG1382,8,KAROL-26813,Dunas secundarias,,,Bonny & Clyde,LOU 26813,PreservedSpecimen
Lamium maculatum L.,Po,Cangas,"Darbo, San Pedro, Fonte Pesada",29TNG1880,30,KAROL-26814,En prados húmedos y sombríos en medio de abundante vegetación,,Abundante,Mariano,LOU 26814,PreservedSpecimen
Lamium maculatum L.,Po,Cangas,"Darbo, San Pedro, Fonte Pesada",29TNG1880,30,KAROL-26814,En prados húmedos y sombríos en medio de abundante vegetación,,Abundante,Carolus,LOU 26814,PreservedSpecimen
Anthemis arvensis L.,Po,Cangas,"Darbo, San Pedro, Fonte Pesada",29TNG1880,30,KAROL-26815,En bordes de caminos,,Frecuente,Mariano,LOU 26815,PreservedSpecimen
Viola riviniana Rchb.,Po,Cangas,"Darbo, San Pedro, Fonte Pesada",29TNG1880,30,KAROL-26816,En prados húmedos y sombríos en medio de abundante vegetación,,Abundante,Carolus,LOU 26816,PreservedSpecimen
Prunella vulgaris L.,Po,Cangas,Donón,29TNG1180,140,KAROL-26817,En márgenes de caminos húmedos y sombríos,,Abundante,Mariano,LOU 26817,PreservedSpecimen
Lamium maculatum L.,Po,Cangas,Donón,29TNG1180,140,KAROL-26818,En márgenes de caminos húmedos y sombríos,,Abundante,Mariano,LOU 26818,PreservedSpecimen
Lamium maculatum L.,Po,Cangas,Donón,29TNG1180,140,KAROL-26818,En márgenes de caminos húmedos y sombríos,,Abundante,Mariano,LOU 26818,PreservedSpecimen
Leucanthemum merinoi Vogt & Castrov.,Po,Cangas,Donón,29TNG1180,140,KAROL-26819,En talud de pendiente,,Frecuente,Bonny & Clyde,LOU 26819,PreservedSpecimen
Reseda media Lag.,Po,Cangas,Donón,29TNG1180,140,KAROL-26820,Sobre talud de tierra,,Abundante,Mariano,LOU 26820,PreservedSpecimen
Acacia dealbata Link,Po,Cangas,Liméns,29TNG1679,70,KAROL-26821,"Márgen de carretera, orientación SO",,Abundante,Bonny & Clyde,LOU 26821,PreservedSpecimen
Oxalis pes-caprae L.,Po,Cangas,Liméns,29TNG1679,70,KAROL-26822,"Márgen de carretera, orientación SO",,Abundante,Carolus,LOU 26822,PreservedSpecimen
Senecio mikanioides Walp.,Po,Bueu,"Bon de Arriba, Borrallido",29TNG1684,100,KAROL-26823,Bosque mixto de Pinus pinaster y Eucalyptus globulus. En Zona sombría trepando por un eucalipto,,Frecuente,Mariano,LOU 26823,PreservedSpecimen
Senecio petasites (Sims) DC.,Po,Cangas,Liméns,29TNG1679,70,KAROL-26824,Zonas nitrificadas en márgenes de caminos,Escapa de cultivo y naturalizada en algunas ocasiones,Escaso,Bonny & Clyde,LOU 26824,PreservedSpecimen
Salvia microphylla Kunth,Po,Bueu,Chan de Piñeiro,29TNG1585,80,KAROL-26825,En la cuneta de la carretera entre vegetación,,Escaso,Bonny & Clyde,LOU 26825,PreservedSpecimen
Ranunculus omiophyllus Ten.,Or,Padrenda,Lapiñeiras,29TNG6963,558,KAROL-26828,Sobre la superficie de un estanque,1 ejemplar en flor,Escaso,Carolus,LOU 26828,PreservedSpecimen
Ranunculus ficaria L.,Or,Padrenda,Gorgua,29TNG7161,570,KAROL-26829,Sobre prado húmedo y parcialmente en sombra,1 ejemplar en flor,Frecuente,Bonny & Clyde,LOU 26829,PreservedSpecimen
Erica arborea L.,Or,Quintela de Leirado,Subida a Penagache,29TNG7561,999,KAROL-26831,Es parte fundamental del sotobosque que tapiza las laderas de los montes de Penagache,"Empieza a florecer, pero sin flores abiertas todavía",Muy abundante. Dominante,Mariano,LOU 26831,PreservedSpecimen
Phalacrocarpum oppositifolium (Brot.) Willk.,Or,Padrenda,Alto de Penagache,29TNG7460,1220,KAROL-26832,Entre las rocas y saliendo en medio del Echinospartum ibericum,Sin flores,Localmente abundante,Mariano,LOU 26832,PreservedSpecimen
Ranunculus nigrescens Freyn,Or,Padrenda,Alto de Penagache,29TNG7460,1220,KAROL-26833,"Tapizando el suelo desnudo, en zonas pisoteadas",Sin flores,Abundante,Bonny & Clyde,LOU 26833,PreservedSpecimen
"Echinospartum ibericum Rivas Mart., Sánchez Mata & Sancho",Or,Padrenda,Alto de Penagache,29TNG7460,1220,KAROL-26834,En las grietas y lugares inaccesible para el fuego y ganado de Penagache,Sin flores,Localmente abundante,Mariano,LOU 26834,PreservedSpecimen
Phalacrocarpum oppositifolium (Brot.) Willk.,Or,Verea,Alto de Froufe,29TNG7558,1244,KAROL-26835,En la cima de Froufe en pequeños prados,,Abundante,Mariano,LOU 26835,PreservedSpecimen
Ilex aquifolium L.,Or,Verea,Alto de Froufe,29TNG7558,1244,KAROL-26836,"En una grieta con escaso márgen, suelo pobre y azotada por el viento",1 ejemplar pequeño,Escaso,Bonny & Clyde,LOU 26836,PreservedSpecimen
Ilex aquifolium L.,Or,Verea,Alto de Froufe,29TNG7558,1244,KAROL-26836,"En una grieta con escaso márgen, suelo pobre y azotada por el viento",1 ejemplar pequeño,Escaso,Carolus,LOU 26836,PreservedSpecimen
Polypodium cambricum L.,Or,Verea,Alto de Froufe,29TNG7558,1244,KAROL-26837,En una grieta semiprotegida,,Escaso,Carolus,LOU 26837,PreservedSpecimen
Vaccinium myrtillus L.,Or,Verea,Corga de Abelenda,29TNG7559,1180,KAROL-26838,"Sobre los taludes sombríos del río de Abelenda, bajo Erica arborea",,Abundante,Carolus,LOU 26838,PreservedSpecimen
Blechnum spicant (L.) Roth,Or,Verea,Corga de Abelenda,29TNG7559,1180,KAROL-26839,"Sobre los taludes sombríos del río de Abelenda, bajo Erica arborea",,Abundante,Bonny & Clyde,LOU 26839,PreservedSpecimen
Paraserianthes lophantha (Willd.) I.C. Nielsen,Po,Cangas,Liméns,29TNG1679,70,KAROL-26840,En laderas de orientación SO,,Localmente abundante,Mariano,LOU 26840,PreservedSpecimen
Paraserianthes lophantha (Willd.) I.C. Nielsen,Po,Moaña,"Meira, Isamil",29TNG2381,30,KAROL-26841,"En talud sobre el mar, de orientación O",,Escaso,Carolus,LOU 26841,PreservedSpecimen
Polygonum capitatum D. Don,Po,Bueu,Bouzón,29TNG1987,30,KAROL-26842,"En la cuneta de la carretera, orientación SE","Naturalizada en numerosos puntos, escapada de cultivo",Frecuente,Mariano,LOU 26842,PreservedSpecimen
Oxalis pes-caprae L.,Po,Cangas,Playa de Areamilla,29TNG1777,5,KAROL-26845,En las rocas del litoral en medio de Rubus ulmifolius,,Abundante,Bonny & Clyde,LOU 26845,PreservedSpecimen
Acacia mearnsii De Wild.,Po,Cangas,"Darbo, Alto da Portela",29TNG1782,120,KAROL-26846,En ladera de orientación E con Acacia dealbata,"En flor, de color amarillo pálido. No muchos ejemplares (<100)",Localmente abundante,Carolus,LOU 26846,PreservedSpecimen
Cladium mariscus (L.) Pohl,Po,Cangas,Liméns,29TNG1578,5,KAROL-26847,"En zona semiturbosa, encharcada y arenosa",,Localmente abundante,Carolus,LOU 26847,PreservedSpecimen
Iberis procumbens Lange,Po,Illa de Arousa,Xidoiro Areoso,29TNH0810,5,KAROL-26848,"En duna primaria, orientación O en medio de Ammophilum",En flor,Frecuente,Carolus,LOU 26848,PreservedSpecimen
Carpobrotus acinaciformis (L.) L. Bolus,Po,Illa de Arousa,Xidoiro Areoso,29TNH0810,3,KAROL-26849,En primera línea de playa junto con Elytirgia juncea,En flor,Frecuente,Mariano,LOU 26849,PreservedSpecimen
Leontodon taraxacoides (Vill.) Mérat,Po,Illa de Arousa,Xidoiro Areoso,29TNH0810,5,KAROL-26850,En la postduna,En flor,Abundante,Mariano,LOU 26850,PreservedSpecimen
Urtica dioica L.,Po,Illa de Arousa,Xidoiro Areoso,29TNH0810,3,KAROL-26851,En zonas húmedas y sombrías de los taludes arenosos,En flor,Frecuente,Mariano,LOU 26851,PreservedSpecimen
Ophioglossum lusitanicum L.,Po,Illa de Arousa,Xidoiro Areoso,29TNH0810,10,KAROL-26852,"En pequeños claros que conforman prados (2 ó 3 m2) aclarados, húmedos",,Localmente abundante,Carolus,LOU 26852,PreservedSpecimen
Romulea ramiflora Ten.,Po,Illa de Arousa,Xidoiro Areoso,29TNH0810,10,KAROL-26853,"En pequeños claros que conforman prados (2 ó 3 m2) aclarados, húmedos pero también en medio de la vegetación.",En flor,Abundante,Bonny & Clyde,LOU 26853,PreservedSpecimen
Stachys arvensis (L.) L.,Po,Illa de Arousa,Xidoiro Areoso,29TNH0810,10,KAROL-26854,"En pequeños claros que conforman prados (2 ó 3 m2) aclarados, húmedos",En flor,Escaso,Mariano,LOU 26854,PreservedSpecimen
Isoetes histrix Bory,Po,Illa de Arousa,Xidoiro Areoso,29TNH0810,10,KAROL-26855,"En pequeños claros que conforman prados (2 ó 3 m2) aclarados, húmedos. También aparecen en zonas con más cobertura",,Localmente abundante,Carolus,LOU 26855,PreservedSpecimen
Cerastium diffusum Pers. subsp. diffusum,Po,Illa de Arousa,Xidoiro Areoso,29TNH0810,5,KAROL-26856,En dunas secundarias,En flor,Frecuente,Carolus,LOU 26856,PreservedSpecimen
Mercurialis annua L.,Po,Illa de Arousa,Xidoiro Areoso,29TNH0810,5,KAROL-26857,En taludes húmedos de orientación N,En flor,Escaso,Carolus,LOU 26857,PreservedSpecimen
Festuca juncifolia St.-Amans,Po,Illa de Arousa,Xidoiro Areoso,29TNH0810,5,KAROL-26858,Por toda las dunas secundarias,,Muy abundante,Mariano,LOU 26858,PreservedSpecimen
Linaria polygalifolia Hoffmanns. & Link,Po,Illa de Arousa,Xidoiro Areoso,29TNH0810,5,KAROL-26859,En dunas primarias y secundarias,En flor,Frecuente,Carolus,LOU 26859,PreservedSpecimen
Elymus farctus (Viv.) Melderis,Po,Illa de Arousa,Xidoiro Areoso,29TNH0810,1,KAROL-26860,En primera línea de playa,,Abundante,Carolus,LOU 26860,PreservedSpecimen
Rubus ulmifolius Schott,Po,Illa de Arousa,Xidoiro Areoso,29TNH0810,7,KAROL-26861,En zona rocosa resguardada de orientación O,,Escaso,Carolus,LOU 26861,PreservedSpecimen
Sonchus oleraceus L.,Po,Illa de Arousa,Xidoiro Areoso,29TNH0810,2,KAROL-26862,En la duna secundaria,En flor,Frecuente,Carolus,LOU 26862,PreservedSpecimen
Zostera marina L.,Po,Illa de Arousa,Xidoiro Areoso,29TNH0810,0,KAROL-26863,Varada sobre la arena,Aún verde,Frecuente,Mariano,LOU 26863,PreservedSpecimen
